Product,Title,Content
Android,Difference in the smartphone culture in India and the US.,"Ok, so in the last few months where I have been browsing through this subreddit a lot, I have noticed some very clear differences in how people in my country (India) and people in US use/need features and, overall, their Android. I find these differences fascinating. English isn't my first language, so sorry for the mistakes. Also, I may be wrong in my assumptions, so feel free to correct me and explain :) 


First off, preferred phone size. People here, and in China too I guess, love huge phones. 5.5"" is pretty common, with 6"" phones also selling very well, though some people like me prefer 5"". But anything smaller than that is considered 'tiny'. Whereas I have seen many westerners here constantly asking for 4.5"" phones, for ease of use. Do people in the US watch movies on their phones? Do they have smaller hands? Also, are smaller phones only a requirement of a few redditors, or is this a common thing among the Android users? Please note that I'm asking these questions out of pure curiosity. 


Second, sms usage. I have seen this discussion quite a lot of times, especially along the lines of Allo-Whatsapp-iMessage. Sms is something we don't actively use for personal communication anymore. Its just there for notifications from banks, getting OTPs, and such. We use primarily Whatsapp and FB Messenger for communication here. Sms fallback (like iMesaage) is not something we want because sms is quite expensive here, and frankly, we just don't use sms much anymore. I think i understand this difference pretty well, but explanation about something I might have missed is welcome. 


Third, budget tier smartphones. Maybe its just reddit, but I get the impression that flagship phones are the most popular ones in the US. India is a huge market for budget smartphones because, lets face it, India is indeed an economically backward country. But the budget section I'm talking about is the sub-15k (around $230), with phones like Redmi 3S, Redmi Note 3, Lenovo Vibe K5 and its Note version, Samsung Galaxy J3, J5, J7, and not about OP3T and similarly priced phones. 20k+ (around $310) are not considered budget here, they are considered expensive. As for the Pixel, I have yet to see a Pixel XL here. So it's not popular at all. How much is that section popular in western countries? I have heard a few things about BLU smartphones. 


Fourth, dual sims. In India, dual sim is a must have feature for most people, students and professionals alike. I myself have two phones, both dual sims. So I have actually four numbers. This is fairly common. If a phone is not dual sim, it won't sell much. Whereas from some comments on Reddit I have seen in passing, I think dual sim is not really a common trend in the US. People still carry two phones with one sim each, one for professional and other for personal use. Why is it so? What are the contributing factors?

Edit : Since a lot of people are asking why I need four sims, let me clarify. I actually don't need 4,I'm keeping two extra just because I can and there is negligible maintenance cost involved. I (and most Indians) use prepaid. We 'reacharge' our numbers with, let's say, 100 rupees, and it gives me around 90 credits. Now I can use this credit to buy data, specific plans with limited validity, or I can just use it to call with the default call rates applying. Or I can just leave it be, and it'd remain there for months, sometimes years. 
Also, I chose 100 rupees as an example. I can also use 10 rupees' recharge. 1$ is around 60-65 Indian rupees. So with 1$, I'm set for months, or even years. 
 Now why I and several other people here use two sims. Without any extra expenditure. And since data packs and calling packs are seperate, the bill actually gets lower. For example, Telenor's call rates are dirt cheap, but its data speed is bad. On the other hand, Airtel has good data speeds, but its call rate is way more than Telenor's. So many people use Telenor for calling and Airtel for data, getting the best of both without shelling out double the money. 


Sorry for the wall of text :p


Tl;dr: lets discuss the differences in how Indians (easterners?) and Americans (westerners) use/need features in their smartphones."
Android,"We asked, you told us: You're not okay with OnePlus installing apps via updates",
Android,Exclusive: Pixel 6 will be powered by new Google-made ‘Whitechapel’ chip,
Android,Android is the only thing stopping Samsung from achieving Apple like control,"Samsung make everything. Their hardware, pretty much *every* component Samsung can create. From memory chips, displays and CPUs, Samsung can make a phone without outsourcing anything. Even Apple can't do this - their components are made by other companies.

Not only that, but they've gotten good at it. The Exynos CPU series is competitive, they have a near monopoly over the OLED market because their screens are downright awesome. They can make a phone from the bottom up, without help (yes ik demand and stuff requires outsourcing, that's not the point).

The only thing they cannot do themselves is the software. They rely on Android and it's clear they don't like it as they seem to be distancing themselves from Google as much as possible. See: Android wear, GApps competition apps, Bixby. Samsung don't have a replacement for Android. Tizen is not made by Samsung and it's pretty bad, the security and ecosystem is crap. So until Samsung make their own mobile OS, they can't get total hardware and software control like Apple. They're very close though.

Thoughts?

EDIT: A few hours after writing this, TechAltar made a video which explains what I'm saying in a better way: https://www.youtube.com/watch?v=2_L9j6mDJBg"
Android,"Motorola's software chief: ""now I can push out updates and upgrades like Android M quicker because I don't need to go through a carrier's submission process.""",
Android,Samsung Made a Bitcoin Mining Rig Out of 40 Old Galaxy S5s,
Android,"""In order to streamline our efforts further, we will be retiring the Google+ Hangouts API."" Apps that rely on Google Hangouts won't work after April 25th",
Android,"The Google Pixel 2 has a Hidden, but Disabled, Dark Theme",
Android,"Motorola Razr fails to reach 100,000 folds in our test",
Android,Samsung doesn't get enough credit for the genius pressure-sensitive home button.,"The latest Galaxy and Note series have a press-sensitive area at the bottom of its display where the on-screen home button sits.

This area allows you constant access home no matter what you are doing. So even if the button isn’t showing (Ex: you are in a full screen app or you have Always-on Display turned off), you can touch the area with a bit of extra pressure (“hard press”) and the phone will return home or wake or even unlock. 

I believe it’s awesome feature that Samsung doesn't get enough credit for.

What do you guys think of their home button?"
Android,OnePlus have admitted the 911 Emergency Call Glitch and is rolling out fix,
Android,"Google Allo and Android Messages are getting a lot of cool updates, and that’s great, but together they could be even better than Whatsapp or iMessage.",
Android,"Regarding the new TOS Google account termination- ""The section of our Terms that you're referring to is not about terminating an account if it’s not making enough money - it's about discontinuing certain YouTube features or parts of the service, e.g. removing outdated/low usage features.""",
Android,President Trump extends US trade ban on HUAWEI for another year. Meaning it will have to survive until May 2021 without conducting business with Google or other US-based companies.,
Android,There is a YouTube channel the copies comments word from word on r/android and uses them in his videos.,"So I'm subbed to a channel and noticed this a month ago when I watched one of his videos and what he was saying sounded exactly like a comment I made in a thread. I brushed it off originally but it happened again only an hour ago so I looked into it. And yes both the comments are exactly the same word for word in his videos. I can't be the only one he's done this to, and I'm sure many upvoted posts were used in his videos word for word. These are just my comments.

Turn captions on!

&#x200B;

Skip to 1:54:[https://www.youtube.com/watch?v=-XWFwDDBsUo](https://www.youtube.com/watch?v=-XWFwDDBsUo)

Original comment/thread:

[https://www.reddit.com/r/Android/comments/a8210i/samsung\_galaxy\_s10\_may\_feature\_bright\_night\_to/](https://www.reddit.com/r/Android/comments/a8210i/samsung_galaxy_s10_may_feature_bright_night_to/)

""I think we knew this was coming. All flagships are adopting this type of  feature. The question is whether it's implemented well. I don't want a  night to day mode like on the P3. Which was basically turning even the  darkest shot into the brightest shot, with orange/yellowish tint. I want  something more like Mate20Pros where it takes an actual darker shot,  makes it clearer and obtain better detail. Yes it's impressive software  regardless, but I think a night mode shouldn't try to make a image super  bright. It should capture better detail in otherwise darker shots where  you'd normally lose the detail.""

&#x200B;

Today, Skip to :20:

[https://www.youtube.com/watch?v=U83lYXPBH7E](https://www.youtube.com/watch?v=U83lYXPBH7E)

Original comment/thread:

[https://www.reddit.com/r/Android/comments/aicl04/the\_most\_premium\_galaxy\_s10\_model\_might\_cost\_1599/](https://www.reddit.com/r/Android/comments/aicl04/the_most_premium_galaxy_s10_model_might_cost_1599/)

""There is absolutely no way these are the legit prices for their phones.  If Samsung had a bad year for 2018, and if they learned anything from  iPhone that same year, they would be completely stupid to sell their  flagships at those prices. 900$ for the budget model? 1800$ for the most  expensive one? I can build a computer for 1200$ that can do everything  the phone can and run all games at medium to high settings. It's not  gonna happen.""

&#x200B;

Thankfully I didn't edit these comments. Should I be mad at this lol? I'm sure I'm not the only guy he's done this to, I mean I find it kind of funny but still.

&#x200B;

**EDIT:**

I just noticed at 1:19 he stole my same comment from yesterday about my prediction for the real prices on the S10 models. Lol.

**EDIT 2:**

Those that pointed this out in the comment section on his video, I appreciate it!

**EDIT 3:**

His email is in his about section on YouTube for ""business enquiries"", in case he decides he will start buying comments instead. You guys can maybe pitch him something and sell him your comments!

**EDIT 4:**

Damage control. He deleted the older video, and a lot of comments have been deleted calling him out.

**EDIT 5:**

Sal has commented on one of the comments I left in the video addressing it and has apologized to me. Seems this effected his channel in some way. Not sure how I feel about it, but while most in my opinion would ignore the issue entirely, he at least apologized for it. A video apology would of been better or if he didn't partake in damage control, but I'll take it . I'd like to point out I originally found this to be funny, but at the same time believed it needed exposure as I feel it's an on going issue. Hopefully this encourages Sal and other channels to push out more original content or to at least credit sources.

Linked image of apology:

[https://imgur.com/a/kdNhXT1](https://imgur.com/a/kdNhXT1)

**EDIT 6:**

Sal has Opted to delete the newest video/comments as well for further damage control, taking back his public apology considering when it was said. I feared he would do this and was actually thinking he'd do the right thing. Sal we know you will still be seeing this post so I want to say to you, not cool Sal. Not cool. Also continuing to delete comments on your videos, and blocking people on twitter is not helping the situation. People are now gonna know your channel is more full of shit than ever.

**TechTalkTv**, I now know you're only sorry because you got caught.

**EDIT 7:**

Sal is denying this was damage control and spinning it as he deleted it because he was receiving racist comments, some others in his comments section were saying people were saying racist things as well ( I can't say what happened during the time of 3am-11am, but before and after I saw no such racist comments, not giving him the benefit of the doubt considering he was deleting comments immediately, and thereafter). As someone who has monitored his channel comments and this subs comments, I saw no such comments and at this point he's spinning his own wheels and playing victim. Sal, we know why you were deleting comments, we know why you blocked followers on twitter, we know why you deleted the videos, and we know why your apology is meaningless given the time it was said, and where it was said.

[https://imgur.com/a/8wqff5y](https://imgur.com/a/8wqff5y)

**EDIT 8:**

This is purely just speculation, but their was a person commenting in the comments section on TechTalkTv's channel with the name ""S R"" defending Sal, and I think one of the only 2-3 people defending him also using the talking point that people were saying racist things. I called him out on it and asked him when was their a racist comment, and he deflected then deleted all his comments. Note: He only deleted his comments after I had immediately said his channel was sketchy. To me this is pretty suspect, that he would use the same talking point as Sal, and then delete the comments after he was called out on it. If I didn't know any better, I'd say Sal made separate channels to rush to his defense and pretend to be someone else. But again this is just speculation. 

Channel in question:

[https://www.youtube.com/channel/UCYtks4ePRp9tyFyCtxMW6Gw](https://www.youtube.com/channel/UCYtks4ePRp9tyFyCtxMW6Gw)"
Android,Will r/Android go private in solidarity with the other major subreddits?,"EDIT: Well it seems that the mods here don't want to go dark. That's unfortunate, IMO. "
Android,"U.S. President Donald Trump: ""President Xi of China, and I, are working together to give massive Chinese phone company, ZTE, a way to get back into business, fast. Too many jobs in China lost. Commerce Department has been instructed to get it done!""","[Tweet.](https://twitter.com/realDonaldTrump/status/995680316458262533)  

[Context.](https://www.reuters.com/article/us-zte-ban/chinas-zte-corp-says-main-business-operations-cease-due-to-u-s-ban-idUSKBN1IA1XF)"
Android,Surprise! The Android N Developer Preview is out right now,
Android,It’s Time to Stop Buying Phones from OnePlus,
Android,Samsung's latest attack ads at the iPhone X,
Android,"Google will ban the use of unexpected ads, ads that can't be closed after 15 seconds, and ads that appear at the start of the game/level.",
Android,LG Has a Go at the iPhone,
Android,LastPass Multi-Device Access Is Now Free! Including Android Devices,
Android,Oppo outright confirmed to us that their 40W degrades to 70% capacity in the same cycles 15W would to 90%. It's all a crock of shit marketing race seeking to have the bigger numbers.,
Android,So let's nip this f/1.6 marketing thing right in the bud while it's just starting,"This is mostly a marketing move, just like sensor size was with other phones like the N6P and Pixel. Neither of those parameters by themselves determine how much light the system gathers. f/1.6 doesn't do any good if the sensor size is smaller, which the V30's is.

No one in their right mind would state that the V30 with f/1.6 has lower noise than a DLSR at, say, f/2 or f/4, and that is obvious to most of us. But why exactly is that? f/number is determined by focal length divided by entrance pupil diameter. For example, to get a similar angle of view to the Pixel camera, a ""full frame"" DSLR would [need](http://www.anandtech.com/show/10753/the-google-pixel-xl-review/4) a 26mm lens. If you set the f/number to f/2, the entrance pupil will be 13mm. This is why the Pixel, with the same f/2 number, does not gather the same amount of light than that DSLR. In fact, the Pixel's entrance pupil is about 2.34mm only. Very small sensors require just very short focal lengths. Sometimes phone and compact camera manufacturers advertise a focal length that's ""equivalent"" to a standard ""full frame"" camera lens but the real focal length of the Pixel's lens, for instance, is only 4.67mm.

I can't think of a better real-world example than the Pixel and the S7. The former advertised a bigger sensor which was true, but can't beat the S7 in noise performance in raw images. The S7 advertised a ""wide"" f/1.7 aperture, but can't unambiguously beat the Pixel either. They both produce about the same amount of noise at equivalent exposure settings (targeting for same shutter speed), and this is because their entrance pupils are not that different in size (2.47mm for S7 vs. 2.34 mm for Pixel). The Pixel has a higher f/number, and the S7 has a smaller sensor, and both basically cancel out their advantages of sensor size and low f/number respectively. Now, if they Pixel had the same f/1.7 number, then the bigger sensor size would have actually mattered. Vice versa for the S7.

See the samples from RAW in [this article](http://www.androidpolice.com/2016/11/21/deep-dive-closer-look-google-pixels-camera/#A_note_on_pixel_size_sensor_size_and_aperture).

This is a big part of the reason the V30's camera doesn't impress. Another part is the camera app like others have pointed out. Google has the right idea, with these tiny camera systems you can only go so far. Much better gains are to be made by applying clever computational photography, and that's exactly what HDR+ is, and why the Pixel's (jpeg) results are so well regarded, cause the raws are nothing special compared to competition like the S7. Microsoft is also [investing](https://www.microsoft.com/en-us/research/product/microsoftpix/) on it. My Sony RX10M3 also has a noise reduction similar to HDR+ but not as sophisticated. This is where manufacturers should be investing most of their camera research IMO. It's the only feature that has actually yielded significant results in the real world. f/number (V30), sensor size (Pixel), and pixel size (HTC Ultra Pixel) as marketing bullet points, cannot claim that.

**EDIT:** see [this post](https://www.reddit.com/r/Android/comments/6xsemd/so_lets_nip_this_f16_marketing_thing_right_in_the/dmiczu7/?context=3) for a bit of extra discussion.

**EDIT #2:** [Here](https://www.youtube.com/watch?v=DtDotqLx6nA) is a video that goes in-depth about this topic thanks to /u/CreeDorofl for [linking it](https://www.reddit.com/r/Android/comments/6xsemd/so_lets_nip_this_f16_marketing_thing_right_in_the/dmih25j/).

**EDIT #3:** /u/poodz asked a relevant question, which frankly I should have included here, but I didn't have the data at the time. What are the actual sizes of the sensors being mentioned? Answer after his/her [post](https://www.reddit.com/r/Android/comments/6xsemd/so_lets_nip_this_f16_marketing_thing_right_in_the/dmipkym/?context=3).

**EDIT #4:** For some reason this is causing some people to get angry, and I have been accused of deleting and editing when I'm proven wrong. *Please* take screenshots of all my posts if you will, I encourage you. For the record, I have not edited either this post or my comments, unless to **add** stuff.

**EDIT #5:** ...to add stuff *and fix typos*. I guess I also had to mention typos or ""some people"" would flip out (not *you*, most civilized commenters who are engaging in good-faith discussion)."
Android,"When 3 of the biggest Android OEMs use notification trays to deliver ads, it’s hard not to look at iOS and wonder if it’s a more consumer-friendly platform.",
Android,Google Maps can now search for electric vehicle charging stations by plug type,
Android,"Google is Serious About Taking on Telecommunications, Here's How They Will Win. Through ""Free Fiber Wifi Hotspots and Piggybacking Off of Sprint and T-Mobile’s Networks.""",
Android,Dark Sky joining Apple - Android app shutting down July 31st,
Android,VLC v3.0 Officially Gets Chromecast Support,
Android,TP-Link engineer explains wifi disconnections tied to Google Home and Chromecast devices,
Android,Google Messages preparing end-to-end encryption for RCS,
Android,Upgrading messaging on Android in the U.S. with RCS,
Android,Cyanogen now has more users than Windows Mobile and Blackberry combined,
Android,Replacement Note 7 Catches Fire in Taiwan,
Android,Why do so many people dislike the blob emojis?,"I just did a quick google on blob emojis and I noticed many people seem to really dislike the blob emojis and especially some tech news authors too, apparently.

Just to name a few: 

[hideous](http://money.cnn.com/2017/05/18/technology/google-emoji/), [awful](https://thenextweb.com/google/2017/05/18/google-android-o-emoji-redesign/), [ugly](https://www.cnet.com/news/google-emoji-android-o-apple-iphone-samsung/), [strange](http://uk.businessinsider.com/google-has-redesigned-its-default-emoji-for-android-o-2017-5), [terrible](http://www.phonearena.com/news/Google-will-finally-replace-the-terrible-blob-emoji-with-not-so-terrible-ones-in-Android-O_id94192)

Well what's wrong with blobs? I think they look adorable af and I have always loved them."
Android,Samsung is beating Microsoft in the battle to turn a phone into a PC,
Android,Exclusive: Google is building two Android Wear smartwatches with Google Assistant integration,
Android,"While the iPhone gets 5 years of support, my Galaxy S9+ still can’t get timely Security Patches",
Android,Spotify brings seekable audio progress bar to notifications on Android 10,
Android,"Facebook, Instagram, and WhatsApp are down for users around the world",
Android,My Open Source Google Play Music Desktop Player just went Cross Platform!,"Hey Guys,  

Main Link: http://www.googleplaymusicdesktopplayer.com  
Original Thread: [Here](https://www.reddit.com/r/Android/comments/3u4pz2/open_source_google_play_music_desktop_player/)  

3 months ago someone (/u/Feenex ) posted my Open Source player for Google Play Music to this subreddit and literally overnight it went from having 20 downloads to 5000. It has continued to grow insanely fast and now has just over 53,000 downloads.  

For the past month now I have been working on porting the entire player to the Electron framework so that it can be cross-compiled for multiple platforms and today I am proud to announce the first release of the cross platform app.  

As of right now you can head over to the [GitHub Repository](https://github.com/MarshallOfSound/Google-Play-Music-Desktop-Player-UNOFFICIAL-) or the [website](http://www.googleplaymusicdesktopplayer.com) and download either the Windows or Mac OSX variants. 
They both have some insanely cool features, just to name a few:

* Hands free [Voice Controls  ](https://github.com/MarshallOfSound/Google-Play-Music-Desktop-Player-UNOFFICIAL-/blob/master/docs/VoiceControls.md)
* Last.fm intergration  
* HTML5 only, no requirement for Flash  
Plus a mini player, dark theme, background audio and a whole lot more.  

Thanks for all your support guys, it means the world.

EDIT: HOLY double gold and we just broke 60,000 total downloads.  This is insane.  
EDIT2: For anyone having issues with the media hotkeys (play/pause) just remove the Google Play Music chrome extension.  For some reason it is stealing the media keys  
EDIT3: Sorry for people getting 500 errors accessing the website, you guys are blowing up my server   http://imgur.com/cSBB1Io  
EDIT4: Final edit here guys, its mean a hectic 24 hours.  Your support and appreciation has been overwhelming.  Thank you so much and I hope you keep enjoying the player"
Android,"YouTube Music's offline playback policies aren't just a nuisance, they're a disgrace",
Android,I really don’t understand the excuses manufacturers make for taking out the headphone jack,"Google said it was taken out to make way for a bezel less future. But wheres the proof of it? The Pixel 2 has the same ugly bezels that the pixel 1 had. The Pixel 2 XL has a somewhat better screen but it still doesn’t feel like a proper excuse to remove the jack as there are still huge bezels on BOTH sides. Should they should have kept the jack on the Pixel 2 and removed it from the XL?

Apple says its to ease waterproofing and they simply didn’t have enough space. Yet they only achieved IP67 instead of IP68. But a guy on youtube proved its somewhat possible.

Again what I want to point out is competition has proven all this wrong. I'm no Samsung fanboy but it can be clearly seen that Samsung has the finest design out there. MicroSD, IP68, Headphone Jack, and a great infinity screen. They even curved the screen at the sides! So isn’t whatever excuse google and apple make invalid? Cause Samsung has already proven them all wrong way back in 2017 March. 

What I feel like is manufacturers are making lazy excuses to just cut off the headphone jack so they don’t have to spend much time in making it work. This is what I love about Samsung is they go all out, no compromises. Wireless charging to headphone jack they load their shit with everything they can find."
Android,"Samsung concludes Note 7 investigation, will share its findings this month",
Android,Samsung design patent reveals a notch and we can already hear the screams,
Android,Android Wear is officially Wear OS,
Android,Google just officially teased the Pixel 4,
Android,Google Maps gets an on-screen speedometer while driving,
Android,Google made a guide on how you switch from IOS to Android.,
