Product,Title,Content
Android,"RIF will shut down on June 30, 2023, in response to Reddit's API changes",
Android,"Google salvaged Robinhood’s one-star rating by deleting nearly 100,000 negative reviews",
Android,Google now prohibits apps that use lockscreen ads,
Android,Chinese Spyware Pre-Installed on All Samsung Phones (& Tablets),"I know the title is rather sensational, however it couldn't get any closer to the truth.

For those who are too busy to read the whole post, here's the TL;DR version: **The   storage scanner in the Device Care section is made by a super shady   Chinese data-mining/antivirus company called Qihoo 360. It comes   pre-installed on your Samsung phone or tablet, communicates with Chinese   servers, and you CANNOT REMOVE it** (unless using ADB or other means).

This   is by no means signaling hate toward Samsung. I have ordered the  Galaxy  S10+ once it's available in my region and I'm very happy with  it. I  have been a long time lurker on [r/samsung](https://www.reddit.com/r/samsung/) and [r/galaxys10](https://www.reddit.com/r/galaxys10/)  reading tips and tricks about my phone. However, I want to detail my  point of view on this situation.

For   those who don't know, there's a Device Care function in Settings. For   me, it's very useful for optimizing my battery usage and I believe most   users have a positive feedback about this addition that Samsung has  put  in our devices. With that being said, I want to go into details   regarding the storage cleaner inside Device Care.

If   you go inside the Storage section of Device Care, you'll see a very   tiny printed line ""powered by 360"". Those in the west may not be   familiar with this company, but it's a very shady company from China   that has utilized many dirty tricks to attempt getting a larger market   share. Its antivirus (for PC) is so notorious that it has garnered a   meme status in China, Hong Kong, Taiwan and other Chinese speaking   countries' Internet communities. For example, 360 Antivirus on PC would   ACTIVELY search for and mark other competitors' products as a threat  and  remove them. Others include force installation of 360's browser  bars,  using misleading advertisements (e.g. those 'YOUR DEVICE HAS 2  VIRUSES,  DOWNLOAD OUR APP TO SCAN NOW' ads). These tactics has even got  the  attention of the Chinese government, and several court cases has  already  been opened in China to address 360's terrible business deeds.  (On the  Chinese version of Wikipedia you can read further about the  long list of  their terrible misconducts, but there's already many on  its English  Wikipedia page: [https://en.wikipedia.org/wiki/Qihoo\_360](https://en.wikipedia.org/wiki/Qihoo_360)).

If   the company's ethics are not troublesome enough, let me introduce you   to the 'Spyware' allegation I made in the title. A news report from the   Chinese government's mouthpiece ChinaDaily back in 2017 reveals 360's   plan to partner up with the government to provide more big data   insights. In another Taiwanese news report back in 2014, 360's executive   even admits that **360 would hand the data over to the Chinese government whenever he is asked to** in an interview ([https://www.ithome.com.tw/news/89998](https://www.ithome.com.tw/news/89998)). The Storage scanner on your phone **have full access to all your personal data** (since it's part of the system), and **by Chinese laws and regulations, would send these data to the government when required**.

With   that in mind, for those who know intermediate computer networking, I   setup a testing environment on my laptop with Wireshark trying to   capture the packets and see what domains my phone are talking to. I head   over to Device Care's storage section and tapped update database (this   manual update function seems to be missing from One UI 2.0), and  voila, I  immediately saw my phone communicating to many Chinese servers   (including 360 \[dot\] cn, wshifen \[dot\] com). I have collected the   packets and import them into NetworkMiner, here's the screenshot of the   domains: [https://imgur.com/EtfInqv](https://imgur.com/EtfInqv).   Unfortunately I wasn't able to parse what exactly was transferred to   the servers, since it would require me to do a man in a middle attack on   my phone which required root access (and rooting seemed to be   impossible on my Snapdragon variant). If you have a deeper knowledge   about how to parse the encrypted packets, please let me know.

Some   may say that it's paranoia, but please think about it. Being the   digital dictatorship that is the Chinese government, it can force 360 to   push an update to the storage scanner and scan for files that are   against their sentiment, marking these users on their ""Big Data   platform"", and then swiftly remove all traces through another update.   OnePlus has already done something similar by pushing a sketchy   Clipboard Capturer to beta versions of Oxygen OS (which compared   clipboard contents to a 'badword' list), and just call it a mistake   later. Since it's close source, we  may really know what's being   transmitted to the said servers. Maybe it was simply contacting the   servers for updates and sending none of our personal data, but this may   change anytime (considering 360's notorious history).

I   discovered that the Device Care could not even be disabled in  Settings.  I went ahead and bought an app called PD MDM (not available  on Play  Store) and it can disable builtin packages without root (by  abusing  Samsung's Knox mechanism, I assume). However I suffered a great  battery  performance loss by disabling the package, since the battery  optimizer  is also disabled too.

After  a bit  of digging, the storage cleaning in Device Care seemed to be  present for  a long time, but I'm not sure since which version of  Android. It  previously seemed to be handled by another sketchy Chinese  company  called JinShan (but that's another story), but got replaced by  360  recently.

Personally,  I'm  extremely disappointed in Samsung's business decision. I didn't  know  about 360 software's presence on my phone until I bought it, and no   information was ever mentioned about 360 in the initial Setup screen. I   could have opted for a OnePlus or Xiaomi with the same specs and   spending much less money, but I chose Samsung for its premium build   quality, and of course, less involvement from the Chinese government. **We,   as consumers, paid a premium on our devices, but why are we exposed to   the same privacy threats rampant on Chinese phone brands?** I  get  it that Samsung somehow has to monetize their devices with   partnerships, but please, partner with a much more reputable company.   Even Chinese's Internet users show a great distrust about the Qihoo 360   company, how can we trust this shady and sketchy company's software   running on our devices?

This is   not about politics, and for those who say 'USA is doing the same, why   aren't you triggered?', I want to clarify that, no, if the same type of   behavior is observed on USA companies, I will be equally upset. As for   those who have the ""nothing to hide"" mentality, you can buy a Chinese   phone brand anytime you like. That is your choice. We choose Samsung   because we believe it stand by its values, but this is a clear violation   of this kind of trust.

**If you share the same concern, please, let our voices be heard by Samsung.**   I love Reddit and I believe it's a great way to get the community's   attention about this issue. Our personal data is at great risk.  
To Samsung, if you're reading this, please **1.) Partner with an entirely different company or 2.) At least make the Storage scanner optional for us**. We really like your devices, please give us a reason to continue buying them."
Android,Chrome will start blocking ads on February 15,
Android,"Reddit gets its app to 50 million Play Store downloads, mostly by making the mobile web experience miserable",
Android,HTC and Motorola say they don’t slow old phones like Apple does,
Android,"WikiLeaks reveals CIA malware that ""targets iPhone, Android, Smart TVs""",
Android,"It's 2018, and Spotify still doesn't let you edit playlists on Android or the web",
Android,As of today Google is blocking the use of YouTube on Amazon devices,
Android,"Two years later, I still miss the headphone port",
Android,The new EU law will force companies to let you uninstall pre-loaded apps,">Separately, Brussels wants large platforms to let users uninstall any pre-installed apps on devices such as smartphones and personal computers, according to the draft, which is in its early stages. 

Finally, no more Facebook and all the other shit that comes along

[Full article](https://www.ft.com/content/1773edd6-7f1d-4290-93b6-05965a4ff0db)"
Android,Google’s blob emoji are great and no one will convince me otherwise,
Android,"I hope Pokémon GO will stay around for years to come. Not because of the game, but because it demands a good battery.","A notable amount of people already bought new phones just because they wanted to get to play Pokémon GO, so that's something.

But the thing is: that shit requires a good battery. My 3 year old S4 drains its self empty really quickly if I keep the game open while walking, and I know that's an issue with newer phones aswell. The big difference between Pokémon and other mobile games is that you'll play the game in places with no way to recharge your phone, and you often play for extended durations at once (instead of just log in, 2 min taptaptap, turn off).

Now in theory, if someone plays that game and is going to buy a new phone, it's more likely that they'll add ""need a really good battery"" on their list of ""features I want""... and as such, in the long run, phones with great batteries will sell more.

Which will, hopefully, lead to companies spending more time developing battery technologies since it's now a bigger selling point than before.

Or maybe they'll just start marketing portable chargers for Pokémon players and nothing else happens because the players will already have their extra battery with that, and they don't need a better phone battery anymore.

I don't really know what I'm talking about, just a showerthought.

TL;DR Pokémon drains battery. Players will buy more phones that have good battery. Companies start focusing more on battery power."
Android,"Snapchat: ""To attract more Android users, we are building a new version of our Android application from the ground up""",
Android,[MKBHD] We live in a world where a brand new iPhone is undercutting every single phone OnePlus has released this year in price,
Android,Apple is now forcing it's devs to reveal probabilities for loot box items purchased in apps from now on. Google needs to do the same.,
Android,"@MKBHD : ""What I wanted to be a trend in 2017 smartphones: Big batteries . What is actually a trend: Dropping headphone jacks""",
Android,"This app is a complete copy of NewPipe, an open-source YouTube alternative. Someone uploaded it on Play store and added ads to it. If you care about the original dev and FOSS, please report it.",
Android,"Netflix Launches Downloads for Offline Viewing on Smartphones, Tablets",
Android,Europe Just Voted in Favor of Making iPhone and Android Use the Same Charger,
Android,It's official. Old and new Note 7 phones are to be powered down and stop being used.,
Android,"Google, please fix Android's slow, bloated share UI",
Android,Google collecting Android users locations even when location services are disabled,
Android,"Google Photos will end its free unlimited storage on June 1st, 2021",
Android,"Vanced has been discontinued. In the coming days, the download links on the website will be taken down. We know this is not something you wanted to hear but it's something we need to do. Thank you all for supporting us over the years.",
Android,Microsoft announces app mirroring to let you use any Android app on Windows 10,
Android,An app to chat with people with less than 5% battery to let the phone die together,
Android,Verizon Announces Plans to Install Spyware on All Its Android Phones,
Android,I had recently migrated from Iphone to Android and realized that Spotify for Android doesn't have the ability to swipe a track to add to a queue which is incredibly useful if you are on the go queueing. Spotify's system for change is based on votes if you would like this feature give it a vote!,
Android,Hilarious Pixel 3 XL bug adds a second notch to the side of the screen,
Android,So it turns out some apps do use your microphone to listen and target you with ads,
Android,Bill Gates says his ‘greatest mistake ever’ was Microsoft losing to Android,
Android,Robinhood plummets back down to a one-star rating on Google Play,
Android,"@MKBHD: You can't hear live, but every time the guy on stage says ""Ok Google"" it triggers the phone of someone in the front row and it's hilarious",
Android,"YouTube's terms of service are changing and I think we should be wary of using ad block, YouTube Vanced, etc. Here's why...","There is an upcoming change to the YouTube ToS that states that:

>YouTube may terminate your access, or your **Google account’s** access to all or part of the Service if YouTube believes, in its sole discretion, that provision of the Service to you is no longer commercially viable.

While this wording is (probably intentionally) vague, it could mean bad things for anyone using ad block, YT Vanced, etc if Google decides that you're not ""commercially viable"". I know that personally, I would be *screwed* if I lost my Google account.

If you think this is not worth worrying about, look at what Google has just done to hundreds of people that were using (apparently) too many emotes in a YT live stream chat that Markiplier just did. They've banned/closed people's entire Google accounts and are denying appeals, and it's hurting people in very real ways. Here is [Markiplier's tweet/vid](https://twitter.com/markiplier/status/1193015864364126208) about it for more info.

It's pretty scary the direction Google is going, and I think we should all reevaluate how much we rely on their services. They could pull the rug out from under you and leave you with no recourse, so it's definitely something to be aware of.

EDIT: I see the mods have tagged this ""misleading"", and I'm not sure why. Not my intention, just trying to give people the heads up that the ToS are changing and it *could* be bad. The fact that the verbiage is so vague, combined with Google/YouTube's past actions - it's worth being aware of and best to err on the side of caution IMO. I'm not trying to take risks with my Google account that I've been using for over a decade, and I doubt others want to either. Sorry if that's ""misleading""."
Android,Android Nougat is here,
Android,"Google Play Music is now officially dead, dead, dead",
Android,Fortnite for Android has also been kicked off the Google Play Store,
Android,"Google Pixel 4 review—Overpriced, uncompetitive, and out of touch",
Android,Samsung pulls own ads after ditching headphone jack,
Android,"BREAKING: (Indian) Govt bans 59 Chinese apps including TikTok, UC Browser, Shein, Helo, Likee, WeChat, Shareit",
Android,"Introducing Pixel, Phone by Google",
Android,Facebook Messenger chief admits the app has gotten too cluttered,
Android,Google plans to block ads natively in Chrome (mobile & desktop),
Android,Samsung patents a fingerprint reader that works on the entire screen,
Android,"FTC Says 'Warranty Void If Removed' Stickers Are Bullshit, Warns Manufacturers They're Breaking the Law",
Android,Samsung Expected to Earn $4B More Making iPhone X Parts Than Galaxy S8 Parts,
Android,Killed by Google - A tribute and log of beloved products and services killed by Google,
Android,Spotify says about two million users suppressing ads without paying,
Android,How Apple removing the charging port scares me as an Android user,"Let's say the speculation ends up being true and the 2021 iPhone will have no ports. Now, I couldn't care less about what features the iPhone has or doesn't have. I use an Android phone. What I do care about, is that Android phone manufacturers have a bit of a reputation for blindly copying Apple in hopes that making the same mistakes as Apple will make them successful. But I digress.

When you think about it, this situation seems eerily similar to the headphone jack going extinct: Apple realized, that they could make a lot more money by selling expensive Bluetooth earbuds, rather than cheap wired ones, so they removed the headphone jack. And soon, nearly every other manufacturer followed suit.

What I'm afraid of, is that the same thing will happen all over again; Apple removes the charging port, creates an expensive, proprietary wireless charger, and others follow along a couple years later.

Now, you could argue that removing the charging port is just so utterly ridiculous, that no other manufacturer would be insane enough to remove it. But, isn't that exactly what we said about the headphone jack?

My point is, that if Apple does end up removing the charging port, we have to make it damn clear to our favorite phone manufacturers, that we won't let them get away with it. Otherwise, there is a high chance history will repeat itself."
Android,Two years of software updates is no longer enough for $1000 Android phones %1000 Agreed. What's your take?,
Android,Evolution of Google App Icons,
Android,Snapchat's troubles are proof that app creators can't treat Android as a second class citizen,
Android,The Predictable Threads are Driving Me Insane,
Android,"It's Official, Android 8.0 is Oreo",
Android,Android P will also Prevent Idle Background Apps from Recording you via Microphone,
Android,"/u/andrewk77, the guy who won an LG G6 from Android Authority on March 5, finally received it today - Just 5 days after making the Reddit post that got to the front page",
Android,"Samsung ends Intel’s 24-year reign, becomes the largest chipmaker in the world",
Android,Introducing PhotoScan by Google Photos,
Android,Instagram will show more recent posts due to algorithm backlash,
Android,Google’s Android Overtakes Windows as the World’s Number 1 Operating System,
