Product,Title,Content
Android,"Hey /r/android! Oneplus broke camera2 api since the 7.0 update on OP3(T), rendering the phone unstable (as proved inside). Refuses to fix it, ignoring the all the complains. We need your help to show them how unacceptable this behavior is."," 
Hey /r/android!  
  
We all praise the efforts from OEMs to keep our phones with the latest software. We love the updates for the new functionalities, increased stability or even for the sake of having a higher number buried on ""about the phone"" section. However it all goes to waste when companies, in this case, oneplus, break and/or limit functionalities which were working good, with a new update iteration.  
  
In this particular case, when the nougat update first started to roll out, people noted strange behaviors when using third party cameras (the ones that rely on camera2 API). Under some situations, the phones would hang for a long long time, crash, and display strange artifacts on the viewfinder. As it impacted heavily the phone camera usage, these issues were massively reported on oneplus forums, twitter and xda. (even by the creator of the known OpenCamera). Despite that, they got ignored, report after report, and still, to this day, almost a year later, there wasn't any official position on the issue  
  
  
On the other hand, using the stock camera app won't reveal any issues. Why? Because it's using a modded legacy API (with HAL3 for the front camera according to sultanxda) to make it work. (The fact that an OEM is still using this method in 2017/18 would deserve its own discussion, but I will leave as it is, since it's not particularly relevant for this topic). But, as you may ask, if the stock camera works seamlessly, why do we need to rely on 3rd party ones?  
  
Several reasons tbh:  
  
- Useless panorama mode  
- **Lack of more advanced controls like intervalometer, exposure metering mode**  
- **Lack of manual video settings**  
- Low quality 1080p time lapse mode  
- No sound with slow motion  
- (you tell me) /s  
  
For those who might have interest on the topic, I'll shed this additional information.  
  
- The camera will always crash during when pointed to bright scenes under some combinations of ISO and shutter speed.  
  
- The exif data (ISO and shutter speed) is incorrectly reported on dark scenes  
  
- Using full auto will allow higher than 799 ISO to be picked by the camera (despite the live stats of the app only read as 799). As soon as you force a manual control, the usable ISO range will be 100-799. Any higher than that and it is the same as 799.  
  
These itself result on a partially useless camera2 API implementation which, if it wasn't enough already, make the phone unstable for every user. All it takes is a camera app download from the play store.  
  
  
Detailed reports can be found [HERE (XDA)](https://forum.xda-developers.com/oneplus-3t/how-to/camera2-bugs-t3569283) [HERE (ONEPLUS)](https://forums.oneplus.net/threads/camera2-api-bugs-for-3rd-party-camera-apps.506100/) and [HERE (oneplus)](https://forums.oneplus.net/threads/camera-api-2-iso-settings-restricted.569762/)  
  
  
**Side note:** currently Google camera port is not 100% stable on our device for the same freaking reason, as it relies solely on camera API.  
  
-  
  
  
I don't like to free bash on companies, but this behavior is just unacceptable.   
Can't just understand how can oneplus have a device unstable for a year without the intention to fix that. I'm really trying to bring attention to this as it is not a minor bug at all.  
  
If this post leads to nowhere, at least I'm trying to inform people of the oneplus *modus operandi*. I still think their hardware is awesome (including my OP3T) but these decisions and the lacking support push me away from a future buy.  
Never settle you say?  
  
  
-  
  
  
  
**TL;DR: Oneplus broke the camera2api since nougat update. Refuses to fix it, there are no official answers, despite it being reported countless times. All OP3(T) on nougat or oreo are not stable. Will face reboots and crashes under some usage patterns due to this problem** 
 

**EDIT:**

Thanks for the support guys!
I've uploaded two videos showing the bug to make our message more clear.

[Max/Reported ISO bug](https://www.youtube.com/watch?v=fWPgj82vIqM)
[Phone Crashing and turning unresponsive](https://www.youtube.com/watch?v=NWA5Sws8rQA)


I believe that we, android users, should have to option to choose. It's even more valid if we consider that our phone was marketed for, not only obviously, enthusiasts. 

That's why we fight to have the api working again. There are people who will find use in being able to shoot 500 30 secs 3200 ISO RAW photos 10 seconds to each other. Other will find the ability to shoot log video at a fixed 1/48 exposure @24p to post produce later on computer. Other will just download GCAM mod and find that actually we can get some flagship level shots from this phone. That's all about what an open and enthusiast phone should be. I simply refuse to accept the situation which looks like a half made job. It's even worse when your new product suffers from similar issues. Oneplus has the funds and dimension to correct address this problem. There's no way a phone with a 440€ price tag can be unstable when using any legit camera app, from the playstore itself, as long as it uses the HAL3.

**EDIT2:** There's a petition up and running that Agent 8923 linked @ comments section

[LINK](https://www.change.org/p/oneplus-oneplus-stop-ignoring-customers-and-fix-the-oneplus-3t-camera)

**EDIT3:** Got a reddit PM from oneplus support. I know it does not mean much as lots of us reported the problem via submission forms and oneplus forums. I've told @oneplus via twitter about the problem 3 times only to be asked to use the bug submition form, which has resulted in nothing. I'm gathering all the info I can (logcats, dumps, crashing patterns, video proof, etc) to send them ASAP (and again lol). I will keep you updated later if it leads to somewhere
 "
Android,NoPhone Durability Test,
Android,"[Thought] In the Google Play Store, the Apps section shouldn't include Games. There's a separate section for Games.",It annoys me because the 'Top Apps' list just gets clogged up with games.
Android,"Samsung Quickly Sold Out of the $2,000 Galaxy Fold",
Android,Not on my watch: Huawei CEO sees no future for wearable smart devices,
Android,Google Play Store adds Free App of the Week Section!,
Android,Chrome 55 will reduce RAM consumption as much as 50% compared to v53,
Android,U.S. Lifts Ban on China's ZTE After It Pays $1.4 Billion Penalty,
Android,"Samsung reportedly trimming TouchWiz fat, aims for a ""Nexus 6-level"" UI for the Galaxy S6",
Android,Barcode Scanner app on Google Play infects 10 million users with one update,
Android,"Skype co-founder launches Wire, an ultra-private messaging app, with end-to-end encrypted (Axolotl) chats, calls, and video",
Android,Google says Android will natively support ‘foldables’ to limit fragmentation,
Android,Microsoft admits Android is the best operating system for mobile devices,
Android,Capcom to bring entire Mega Man NES series to Android,
Android,The Qualcomm Snapdragon 875 might cost $250 dollars according to leaks,
Android,"Samsung, not Apple, is leading the next exciting phone industry change",
Android,There’s now a petition to stop Samsung from using Exynos processors,
Android,Just stopped a fake Galaxy S6 craigslist deal that happened to be next to me. Be careful! (x-post from /r/GalaxyS6),"Old lady drives down from Reno to a Starbucks in Sacramento (2 hour, 100 mile drive) I just happen to be sitting in at that time. She is there to purchase a $400 (MSRP $650) Galaxy S6. 30 minutes later (rudely late) a well built guy with a red striped brotank walks in, sits down with the lady. The S6 is uncharged because its ""new"". He makes small talk and plugs it in to charge. While it's charging, he tries to get the money from her right there and then (complaining about being in a rush), but thankfully, she doesn't give in and is adamant to see the S6 functioning.

I decide get up and walk by and notice the charger appears to be fake. To take a closer look, I ask if I can hold the ""S6"" so ""i can get to see what a white S6 looks like"" in comparison to my Black S6, look at the back, FCC tags are obviously fake (Thanks to the video below, I was able to recognize this S6 as a fake immediately). I say ""I need to order a drink"" to excuse myself from the seat, and ask starbucks staff if they can do anything about the scam about to take place, they can't. They tell me to ""Follow your heart"". (or some fucking bullshit, as they can't do anything store policy etc)

I decide to pull her aside and tell her its 100% fake, to walk away from this deal, and to not look back. She goes into the bathroom and locks herself in there (afraid that she might get followed if she got in her car) Scammer walks away looking fucking pissed and gives me a look as if he's gonna beat me into pieces. (This guy was not small)

Thank god for [this video](https://www.youtube.com/watch?v=H4ovScUEGDM) I watched a few weeks ago

Edit: took pictures from behind 

http://i.imgur.com/LsyDTYL.jpg

http://i.imgur.com/ytKsemv.jpg

Regret not taking a video :/

TL;DR Watch this video before buying an S6 on craigslist.

www.youtube.com/watch?v=H4ovScUEGDM"
Android,Google announces Pixel 4 and Pixel 4 XL starting at 799$,
Android,Shuttle Music Player is now open source!,"Hey /r/Android,

Over the years, I've given thought to the idea of open sourcing Shuttle. I enjoy open sourcing stuff - it's nice to be able to show off what you can do, help others, and also get some help in return. It's also nice to give back - without open source, Shuttle wouldn't exist.

For those who don't know it, Shuttle is a local music player for Android. 

Check it out [Play Store](https://play.google.com/store/apps/details?id=another.music.player), or via the [website](https://www.shuttlemusicplayer.com)

It started off in early 2012 as a project to learn how to code. With some really positive feedback and encouragement from /r/Android, and as my skills developed it slowly picked up momentum, and became a relatively successful app (at least in my books), reaching around 4 million downloads, and earning ~$AU150k in its 4 years of life.

I'm really proud of what I've been able to do with the app. It's led to a job as a full-time app developer, and I now develop both iOS and Android apps full-time. 

It's worth noting though, that none of this was possible without open source, and help from the kind of people who love open source. When I was starting out, I discovered Apollo Music Player, and its developer, Andrew Neal. I sent him a bunch of emails asking how he managed to get around certain problems in the app. Although I considered the apps to be sort of in competition with one another, he couldn't have been more approachable and happy to help. Over emails, hangouts and eventually Slack, he ended up teaching me how to use Git, Eclipse (ugh), Java patterns, and tons more. Basically, he unwittingly and enthusiastically became a sort of mentor. It still surprises me to this day how someone can be so happy to take time out of their day just to show some random stranger on the internet how to do something. Yet, the same thing happens to me now, from time to time I'll get hit up on hangouts with someone asking how I solved a problem in Shuttle, and though it's not much effort for me, I always remember to pay it forward.

So, here's hoping that Shuttle can be to someone else, what Apollo was to me!

[Shuttle Music Player on Github](https://www.github.com/timusus/Shuttle)


---

For developers:


Part of the motivation behind open sourcing Shuttle is also because I'd like to see the development move ahead a bit faster. In other words, I'm looking for **contributors**. So, if you're a beginner looking to get your hands dirty, or there's just that one feature that's lacking, and you think you know how to solve it, please feel free to give it a crack. Open an issue or make a pull request.

I don't have as much free time as I used to, and I also find that one of the downsides to working full-time as an app developer, is I'm less enthusiastic about writing code late into the night. Also, weirdly, the better I get at coding, the higher my standards are, and the *longer* it takes me to get things done.

I'm still actively developing Shuttle though, and I'll try to be as responsive as possible when discussing features, pull-request & bugs.

Shuttle uses a few modern technologies & libraries, including RXJava, Retrofit and Glide - and I think there's plenty to discover there for all kinds of developers.

However, I'm no expert. So, if you see some crazy piece of code that makes your eyes bleed, make a PR or let me know!


For Shuttle users:

Hopefully Shuttle will become a bit more active, and you'll start seeing some more features sooner.

I'm also using a public issue tracker now (https://github.com/timusus/Shuttle/issues), so it should become a little easier to track the progress of feature requests and bug fixes.


---

I'm really excited about this new chapter for Shuttle, but it's quite nerve-racking as well.. Shuttle development has been a dictatorship for the last 4 years, where I've had the final say on everything. I'm now stepping back a little bit to allow others to contribute, so that will take some adjustment.

The other scary thing is putting all this code out there for everyone to see. I imagine this is how Cersei felt being marched naked to the Red Keep. I can imagine some developers digging around in the code and ringing a bell, crying 'shame, shame'. There are a few shameful bits of code, but there's some gold in these hills as well.


Anyway, I'm probably gonna fall asleep pretty soon, but I'll be back in a few hours to answer questions, so AMA away.

Edit: I have to sleep now, it's 3am in Aus. I'll be back to answer more questions in a little while. 

Edit 2: OK, I'm back!"
Android,Samsung pulls ahead of Apple in consumer satisfaction,
Android,"Hey Reddit, the Big Android Summer Giveaway begins! (Part 1 - A Nexus 5 and two amazing headphones)","As promised, here’s my Big Summer Giveaway, open internationally. There will be a giveaway a week for a total of **five** weeks. Entries do get rolled over, so you can increase your chances by entering every week. 

More information on how entries are rolled over and the upcoming weeks of the Big Summer Giveaway [**here**](http://blog.shenye.co.uk/Big_Summer_Giveaway_2014).

To start off this week [*Slant.co*](http://www.slant.co/?tag=android), a cool community based platform for finding the best software/hardware, have provided me the following prizes to give away! (1 prize per winner)

1. [Nexus 5 32GB - White, Black or Red!](http://www.google.co.uk/nexus/5/)
2. [Audio Technica ATH-M50 - Black](http://www.audio-technica.com/cms/headphones/0edf909675b1be4d/)
3. [Sennheiser 380 Pro - Black](http://en-uk.sennheiser.com/monitoring-headphone-studio-headphone-professional-audio-hd-380-pro)

**So what are the rules? (please read it all)**

* To enter, just simply enter your email address to the Google Docs form. You will find a link to the form below.

* Your email will only be used for this giveaway. Only I have access to the emails. They will not be sold or passed onto anyone unrelated to this giveaway.

* The giveaway closes on the 8th August 2014 at 13.00 British Summer Time (GMT+1).

* I will use a random number generator to select the winner. Duplicate entries will be deleted before we do this (originals kept). My decision is final.

* Winners will be contacted within 2 days of the giveaway deadline from an email on my domain (shenye.co.uk). Winners will have 48 hours to reply, else I will pick a replacement winner.

If you like this giveaway, why not go and tweet a thanks to [*@SlantCo*](http://www.twitter.com/slantco) for providing the awesome prizes!

Good luck!

/shen

.


[**ENTER THE GIVEAWAY HERE**](http://blog.shenye.co.uk/Slant_N5_Giveaway)

.

P.S. I'm not allowed to ask for upvotes, but all I ask is don't downvote just to screw other people's chances please. It reduces the likelihood of me being sent things for future giveaways.
"
Android,Prisma for Android now publicly available,
Android,"""Hey Google, That Wasn't for You"" is a Good Command to Know | Droid Life",
Android,Google will delete your Play Music library later this month,
Android,"Samsung Galaxy S20 Sales Tank Compared With S10, Coronavirus Blamed",
Android,"To all Android devs: Give us changelogs, please","Am I the only one that gets annoyed when app updates in the play store say ""bug fixes and performance improvements""?
Come on devs, give us proper changelogs. It will actually help us users find and use new features. Also it is very nice to see if a specific bug one was encountering might have been fixed. And what performance is improving and why. Thanks!"
Android,Retailers are disabling NFC readers to shut out Apple Pay (Which will affect us too),
Android,Google removes the tablet section from official Android website,
Android,"PSA: On Android 8.1 as it is now, forgetting your screen lock PIN/Pattern/password will permanently brick your device.","Here's the story of how this happened, if anyone's interested. 

I upgraded through the beta program to 8.1 so I could use VoLTE and HD voice on AT&T with my Pixel 2 XL, which worked. Due to another really boring story, I forgot my new unlock pattern. I couldn't get in via Android Device Manager, because it no longer removes your current lock, so I factory data reset my device, thinking that Factory Reset Protection would ask for my google password and all would be well.

Well, as of 8.1, it doesn't any longer. Now, instead, Factory Reset Protection asks you for you ""previously used secret"" and gives no option to change the input from pattern (in my case) to anything else. Google technical support confirmed this by requesting I factory reset again, and then replacing my device via RMA.

I also tried flashing 8.0 factory images, and even downgrading my device doesn't work. I get an error from fastboot that is virtually ungoogleable. It says [FAILED \(remote: check device console\)](https://imgur.com/a/bu3te)

I'm not looking for help in any way, I just wanted to warn everyone on the beta, and that this may be a sign of things to come in the future of Android."
Android,Android User Takes Apple To Federal Court Over Undelivered Text Messages,
Android,"Despite major upgrades, Apple’s iPhone XS still doesn’t match the Pixel 2’s camera",
Android,"Petition for OnePlus to remove the file manager clean up, made by Tencent",
Android,The bottom Nexus bezel is so big because it's a recycled design that used to house a fingerprint reader,
Android,Epic Games are launching an Android store in 2019 - 88% revenue share,
Android,Snap responds to change.org petition to remove snapchat update 2018,
Android,Samsung fires three execs over Galaxy S5 failure,
Android,Google should segregate games from the app category,"Ever since the Play Store was named as such, the app category when shopping apps includes games. This is unnecessary because there is another section for games. Currently on the ""Top Apps"" tab, the first ""app"" is number 32. 

This has always been an inconvenience to both new and experienced users. 

Edit: Glad to see there is concern about this. Too bad there are no quality channels to communicate this to google staff."
Android,"""I have a feeling 8 years from now we'll be talking about Oct 4, 2016""",
Android,"Google Pulls 13 Android Apps Installed Over 500,000 Times Containing Malware",
Android,Samsung brings Bixby key remapping to older flagships,
Android,The Verge Compares the new iPhones to Flagship Android Phones- Uses 2 year Contract Price for iPhones and Unlocked Price for Android phones,"Post to the article got removed so posting a self post instead. 

Here's the article comparing various Android phones to the new iPhones: http://www.theverge.com/2015/9/9/9263285/apple-iphone-6s-plus-vs-android-spec-price-feature-comparison

[And here's a picture of the table in question](http://i.imgur.com/w40ZoTe.png)

Credit to /u/udonedidit for pointing this out in /r/apple"
Android,Android Phones Might Be More Secure Than iPhones Now,
Android,Google Set to Unveil Wireless Service as Early as Wednesday,
Android,Game developer's code is so bad it breaks the app sandbox and actually manages to corrupt data as a non-root access.,
Android,Google is eating Apple's ecosystem for lunch,
Android,Samsung says two separate battery issues were to blame for all of its Galaxy 7 Note problems,
Android,"The S7 has a ""Moisture detected"" Feature when the S7 Charging Port is wet",
Android,Google Messages to show iMessage reactions as emoji,
Android,Nokia keeps the headphone jack and announces true wireless earphones,
Android,Who would've thought in 2018 that Samsung would be the hero of /r/android?,"5 years ago Samsung was probably the most hated manufacturer on this subreddit. Some of the complaints had merit (laggy software), some were trivial (the default s3 notification sound is too annoying) but overall the general attitude towards Samsung was very negative.

Now? Samsung is the only OEM keeping things real. No notch, retaining the 3.5mm jack, SD card and improved software with every iteration.

HTC is dead

Motorola is dead

Sony is dead

LG is dying

Oneplus settled

Nexus/Pixel Apple-fied

Chinese OEMS cheat on benchmarks and steal your data

Samsung is the hero we don't deserve



"
Android,The Audiophile’s Perspective: Best sounding True Wireless earphones in 2019?,
Android,I took a photo with the Pixel that changed my mind about the iPhone,
Android,"EU proposes mandatory USB-C on all devices, including iPhones",
Android,"With the Note 7, Samsung Still Delivers Embarrassing Real-World Performance",
Android,Gionee on verge of bankruptcy as chairman loses $144m at casino,
Android,Google Chrome on Android will stop background tabs after 5 minutes to improve performance,
Android,Google Maps speed limit feature goes live for some across the United States,
Android,Tech’s cult of thinness needs to come to an end,
Android,"OnePlus signs $300,000 House of Cards season 4 endorsement deal",
Android,Android 6.0 Marshmallow factory images available for Nexus 5/6/7/9 and Nexus Player.,
Android,Ring Doorbell App For Android Packed with Third-Party Trackers,
Android,"With the removal of the headphone jack on the Pixel 2, the Moshi USB-C to 3.5mm adapter/charger is coming soon on the Google Store at $44.95",
Android,Phone startup Nextbit has stopped production and is selling its assets to Razer,
Android,Nova Launcher Prime On Sale For $0.99,
Android,Lawsuit against Apple after they acknowledged they don't deliver iMessage texts to Android,
Android,"Samsung officially recalls Note7, ""New Note7s will be available at your carrier and retail outlets no later than September 20, 2016.""",
Android,"Someone Got Android 1.6 Running On A Texas Instruments Graphing Calculator, OnePlus One Owners Feel Strangely Jealous",
Android,"""Superzoom"" lenses will be the biggest thing to happen to smartphone cameras in years",
Android,My new year’s resolution: no more MicroUSB,
Android,Android 12 will finally let alternative app stores update apps on their own,
Android,Cellebrite Says It Can Unlock Any iPhone (and most widespread Android phones) for Cops,
Android,It's unfortunate that the Pixel phones only have Linux 3.18 rather than 4.1 or 4.4... they're held back by the out-of-tree Qualcomm drivers.,
Android,OnePlus 6's face unlock bypassed using printed photo. (also works using B&W photo),
Android,"Android 5.0 Makes SD Cards Great Again, Extends API To Allow Full Directory Access, Automatic MediaStore, And Improves Security",
Android,Google Photos will no longer provide unlimited storage for unsupported video files,
Android,"Google, please bring back Google Play Edition devices!","IMO, Samsung makes the best hardware out of all of the Android device manufactures. I wish Google would bring back the Play Edition devices. That way I could have a Samsung Galaxy S8 with software updated by Google.

Do you think the Google Play Edition devices will ever come back?"
Android,OnePlus 3 and future OnePlus products won't use the invite system,
Android,Telegram chat app blocked in Russia,
