Product,Title,Content
Android,"After the fake reviews, Alcatel is now forcing users to rate an application with 5 stars to use it","Unfortunately, seems that Alcatel (or TCL, to be more correct, as they're the ones using the Alcatel brand for mobiles) has crossed another line with its new approach in their Android apps. After replacing the default apps sold with their phones with adware-filled ""alternatives"", after adding those applications into a security update to force them onto the users, after adding a series of fake five star reviews... now comes the time for the forced five star ratings.

In their [Calculator application](https://play.google.com/store/apps/details?id=com.tct.calculator), Alcatel now forces the users to [rate the application with 5 stars, before using the scientific calculator options](https://i.imgur.com/yMlrAx3.png). Sometimes, I wonder if they simply try to come up with new ways to break their customers' trust just for the fun of it. 

**Updates**

There are a few updates I'd like to make to the original post, based on some things that changed and comments on the thread.

* Regarding the comments that this is not an Alcatel application: this was the application that, up until it was removed, was replacing the stock calculator application in Alcatel phones when updating it (that's how I ran into it, as I have an Alcatel idol 4, and other Alcatel users already commented the same in the thread). Replacing the stock apps with these shady versions is something that Alcatel has been doing for a few months: [news item @Slashgear](https://www.slashgear.com/alcatel-apps-just-went-adware-on-us-29517407/), [news item @AndroidPolice](https://www.androidpolice.com/2018/01/29/default-gallery-app-alcatel-phones-replaced-spamware-users-angry/)). Unfortunately, this is really tied to Alcatel, even though there's a gmail email account as a support link - which also happens in [other Alcatel applications](https://play.google.com/store/apps/details?id=com.tct.gallery3d).

* It seems that the unlock worked even if the users rated it with less than 5 stars (I didn't test unlocking it with a lower rating, but there are a few reports of this in the thread). However, since the unlock message clearly stated that 5 stars were required, the vast majority of users was rating it with 5 stars (while leaving comments saying that they were doing it only to unlock the features). This is still against the Play Store's ToS (and a very shady thing to do).

* The application seems to be gone from the Play Store. It is also no longer showing in my Idol 4 (as of this morning).

* In my Idol4, the update notification for the other Alcatel stock applications has disappeared. I'm not sure if there's any relation to this situation. Up until now, I had update requests for all the stock applications to turn into their ""spam"" alternatives, but now they're not even listed under my installed apps. Can other Alcatel users confirm if the same is happening to them?

* The developer seems to have a [second version of this calculator](https://play.google.com/store/apps/details?id=com.tct.calculator2) currently up. I'm not sure what's different or if it also has the rating demand. However, this second version doesn't seem to replace the stock app when updating OTA on Alcatel phones."
Android,Samsung launched a new phone with a removeable battery,
Android,"Google announces the Pixel 3A and 3A XL, starting at $399",
Android,Target's Sales Floors Are Switching From Apple to Android Devices,
Android,Safer Internet Day 2016: Get 2GB of Google Drive Space for doing the Security Checkup,
Android,"In late 2008 many critics thought Android would fail miserably whereas, as of Feb 2015, Android holds about 85% of the total smartphone OS market share",
Android,we wanted to invite you to /r/apple to help support us boycotting retailers that are disabling NFC. It affects us both!,
Android,The Oneplus 6t Wont Have A Headphone Jack,
Android,"PSA: Don't install the Meitu photo app, its sending IMEIs to some srvers in China.",
Android,Man Sues Samsung After Exploding Galaxy S7 Edge Causes 3rd Degree Burns,
Android,"Is metal really a better material than plastic on phones? Metal and glass might look nice, but phones made out of plastic were never really bad in the first place",
Android,Google says it doesn't support 4K60 because it takes too much space and they wanted to improve FHD instead,
Android,"Google signs agreement with HTC, continuing big bet on hardware",
Android,Cyanogen Inc shutting down by the end of the year,
Android,Just say no to 16 gigabytes of storage in 2015,
Android,Samsung’s removable-battery smartphone is coming to the US for $499,
Android,Whatsapp just implemented end-to-end encryption.,
Android,I'd rather have excellent software over flashy hardware,
Android,It is now a federal crime to bring a Galaxy Note 7 onto an airplane,
Android,A film student let a thief steal his smartphone and followed him several weeks with a hidden app - He made a film about it,
Android,Huawei caught claiming DSLR images were taken with its phones,
Android,Nintendo Switch Joy-Con controllers work natively on Android,
Android,"Samsung refuses to issue me a refund, has had my phone for 26 days and counting.","I bought my Note 7 through Swappa and a day later it was recalled for the second time. I sent in my phone to Samsung and they received it on the 20th of October. It has been 26 days and I have not received a refund or any sort of useful information.

When I initially sent in the phone I was told it would take 2-3 business days. Then when 3 business days came it got pushed to 3-5 business days and well you get the picture.

It has now been 26 days since they've had possession of my phone and not a single person at Samsung can explain to me why I have no received a refund or whether I am even getting a refund. All the managers I've escalated the situation to have told me ""I'm sorry, there's nothing I can do, you just have to wait.""

Samsung does NOT care about its customers, all they want is to get their phones back and not refund you for them. 

I am not alone, on the Note 7 subreddit and xda-developers no one has received a refund yet either.

I want to get the word out there to let everyone know how Samsung is treating its loyal customers. Please never buy Samsung again. People deserve better.

edit: The most frustrating part is how Samsung has no answers. Every representative or supervisor I've spoken to the last 3 times has told me they don't know why I haven't received my refund and they have no way of investigating and finding out why. I've worked in customer service before and it boggles my mind that they think it is acceptable to just tell a customer ""I don't know."" and that's the end of it.

edit2: There is a thread on the android central forums with plenty of people in the same situation as me. No one has received their refund or answers. http://forums.androidcentral.com/samsung-galaxy-note-7-returns/726774-second-hand-note-7-recall-thread.html

edit3: I see a lot of people telling me to do a charge back. That would just screw over the original person who sold the phone to me, not Swappa. The Note 7 is being recalled for safety concerns, so whether I bought it from Samsung, Swappa, or a man in a parking lot, they are responsible for it. They are the ones pushing every user out there to return their Note 7s as soon as possible, so they have to take responsibility for making things right.

If you bought a used car from someone and the car exploded while you were driving (due to a manufacturers defect) are you going to hold the person who sold it to you responsible? or the manufacturer of the car?


"
Android,"Exclusive: Android Oreo Will Receive Rootless, System-Wide Theme Support Within 1 Week",
Android,"[MKBHD] ""My Pixel 6 Pro has slowly gotten so buggy since launch in October that I can no longer recommend it at $900. Combined with the latest botched update it's just been a bad experience. My SIM is back in an S21 Ultra til the next review.""",
Android,Exclusive: This is the Essential Phone,
Android,Verizon has a plan to make the Android bloatware problem worse,
Android,Forensics detective says Android encryption now superior to iPhones,
Android,I Wish Google Would Figure Out What They’re Doing With Music – Droid Life,
Android,"How Google is Laying the Foundation to Kill Rogue Background Services, and Improve Battery Life",
Android,Samsung chief Lee Jae-yong arrested on charges of bribery,
Android,[PSA] Dialling 911 may reboot your OnePlus 5 (x-post from /r/OnePlus),
Android,This is why I android,"Hoping this is ok to post here. 

http://i.imgur.com/R1yJMeQ.png

My father is 78 years old, he's living alone, he fell the other day and was unable to reach the phone. He is now fine, but of course I am worried about him. I go to bed around 11pm, while he goes to bed around 1am. So I set an alarm for 12:59am, to pre-wake me, and automated the call process to be directly on speakerphone (my phone charges on the night stand beside my bed). This way I know if he doesn't pick up, I need to head over and check on him. 

Thank you android, for being so completely capable of handling these circumstances. I tested it for the first time tonight and it worked beautifully. I'll rest easy knowing my dad is alright and I didn't have to lift a finger to do it. "
Android,Google Will Not Allow OEMs To Hide Information From Battery Stats In Marshmallow,
Android,"Google resumes its senseless attack on the URL bar, hides full addresses on Chrome 85",
Android,Sync for reddit (including Pro) is Injecting Amazon Affiliate Tags into your Amazon Clicks,"**tl;dr - Sync for reddit (including Pro) is injecting their own Amazon affiliate tags into every Amazon link you click within the app.  There is no option to disable this**

While discovering this, I was using v11.6.5 of Sync for reddit (Pro)

I first unknowingly discovered this 9 days ago but this likely has been around for much longer.  I was going through my hidden posts on Wednesday of this week (Sync automatically hides reported posts) and decided to look at one that I reported for including their own affiliate code (it was in a subreddit specifically to buy things and disallowed affiliate tags) to see if it was removed.  It wasn't.  The first comment was by a mod in response to my report saying there was no affiliate code in the link.

I know there was when when I checked it out.

I checked out the link again, using Sync, and there it was in plain site.

> tag=fheuivhierfiu-20

How could the mods not have noticed this?  That is when I decided to go to my computer and see if my browser is showing the same URL.  Keep in mind, I have already disabled affiliate links in my reddit preferences in my browser so there are no Reddit affililate tags being added to my outbound clicks.

It wasn't; the URLs were different.  There was no affiliate link; the mod was right.

I then started trying out all of the Amazon links I could find using Sync.  They all had it; the same affiliate code.  All of these links were posted in different subreddits by different users.

Before creating a post in their support subreddit (/r/redditsync), I tried searching and looking in their FAQ if they made any mention at all about affiliate tags.

They didn't.

I then tried to create a text post asking about it, making sure to use the correct flair and information.  This post was automatically removed by AutoModerator due to their filtering rules. It was probably because my post included their own Affiliate tag, but which filter exactly? I have no idea as I have messaged them to find out why and have not received any reply from them.

The post I created can be seen here: https://www.reddit.com/r/redditsync/comments/4yfxo7/question_is_sync_automatically_injecting/

---------------------------------------------------------

**For anyone using Sync, you can see this for yourself by using the link below.**

https://www.reddit.com/r/buildapcsales/comments/4ycp6z/amazon_steam_controller_35_50/

When opening the link, first open the Amazon link within the app.  Once the Amazon page has loaded, then choose ""Open in Chrome""

You'll see the following URL: https://www.amazon.com/dp/B016KBVBCS?tag=fheuivhierfiu-20

If you open the URL on your desktop's browser, you'll see the following link instead: https://www.amazon.com/Steam-Controller-SteamOS/dp/B016KBVBCS/ref=sr_1_2?s=videogames&ie=UTF8&qid=1471532042&sr=1-2&keywords=steam+controller

Now some of you may be okay with this, supporting the developer by clicks.  I understand that and I have supported them in my own way by purchasing the Pro version of the app.  I can understand if they put their affiliate code in the free version.  Personally, I don't believe the affiliate code should be used unless they are the person directly influencing the purchase of the item; that's why I disable reddit's Affiliate links.  The person that deserves the bounty is the one who has posted the link.

At the very least, there should be an option to disable this.  Instead it's being hidden with no way to disable it."
Android,"We asked, you told us: You'd rather have bigger bezels than a notch",
Android,The Galaxy S7 and S7 Edge are outselling the iPhone 6s and 6s Plus in the U.S.,
Android,"The Brave web browser is hijacking links, and inserting affiliate codes",
Android,Google won't void your warranty if you root your Pixel 2,
Android,Pixel 4 battery life is biggest reason not to buy it,
Android,"Google Says It Will Stop Android Phones From Suggesting ""My Face"" When Users Type ""Sit On""",
Android,"Zuckerberg Plans to Integrate WhatsApp, Instagram and Facebook Messenger",
Android,Spotify and Waze partner to play music and navigate seamlessly,
Android,"When Facebook bought Whatsapp the FTC said:- ""We want to make clear that, regardless of the acquisition, WhatsApp must continue to honor these promises to consumers."" - Time to step up?","So when Whatsapp was bought by Facebook, Whatsapp at the time had been making loads of promises about privacy, that they'd never sell out etc and got loads of users off the back of this before doing exactly what they said they wouldn't.

As part of the deal to buy Whatsapp the FTC stated the following:-

""WhatsApp has made a number of promises about the limited nature of the data it collects, maintains, and shares with third parties — promises that exceed the protections currently promised to Facebook users, we want to make clear that, regardless of the acquisition, WhatsApp must continue to honor these promises to consumers.""

""Before changing WhatsApp's privacy practices in connection with, or following, any acquisition, you must take steps to ensure that you are not in violation of the law or the FTC's order,""

Apparently they then laid out 3 guidelines to avoid issues:

First, if WhatsApp eventually starts using collected data ""in a manner that is materially inconsistent with the promises WhatsApp made at the time of collection,"" **it must obtain affirmative consent before doing so.** The company is also forbidden from misrepresenting the extent to which it protects WhatsApp user data. And finally, if WhatsApp suddenly changes how it collects, uses, or shares new data, the FTC is urging the company to let users opt out — or at the very least ""make clear to consumers that they have an opportunity to stop using the WhatsApp service.""

Now thats not what Facebook is doing - if you opt out your only opting out of the ads, NOT from sharing with the rest of the ""Facebook Family""

So - will the FTC step up and enforce what they promised they would?

Sauce - http://www.theverge.com/2014/4/10/5601878/ftc-issues-stern-privacy-warning-to-facebook-whatsapp

**EDIT1**:- Here another source on TechCruch with more quotes and info
https://techcrunch.com/2014/04/10/whatsapp-privacy/


> After the acquisition announcement, **WhatsApp wrote “Here’s what will change for you, our users: nothing** …. And you can still count on absolutely no ads interrupting your communication.” **Facebook CEO Mark Zuckerberg said “We are absolutely not going to change plans around WhatsApp and the way it uses user data”,** and **a Facebook spokesperson confirmed Facebook would uphold WhatsApp’s promises to users.**

WhatsApp’s most recent privacy policy (prior to sale) from July 7th 2012, states that:


    “WhatsApp does not collect names, emails, addresses or other contact information from its users’ mobile address book or contact lists other than mobile phone numbers”
    “We do not collect location data”
    “The contents of messages that have been delivered by the WhatsApp Service are not copied,
    kept or archived by WhatsApp.”
    “We do not use your mobile phone number or other Personally Identifiable Information to send commercial or marketing messages without your consent”
    “We do not sell or share your Personally Identifiable Information (such as mobile phone number) with other third-party companies for their commercial or marketing use without your consent”

**EDIT2**: I see people below asking what can we do, that tech companies are getting off with this way too often. We need the tech sites to start picking these things up and running with them. Their voice on these matters is too quiet. They should be onto issues like this, asking Facebook and whatsapp for comment and making the case for us as well as getting the word out as to what is happening. Only by making everyone aware of what is being allowed to happen can this be stopped.

**EDIT3**: In the meantime - here's an excellent article from Motherboard on how to, at least partially, stop ""Facebook"" from using your phone number. Remember though they still intend to use your data for the rest of the ""Facebook Family""

http://motherboard.vice.com/read/whatsapp-facebook-phone-number-how-to?utm_source=mbtwitter

**EDIT4**:- Some good news, at least in the UK, the UK's Information Commissioner (ICO) is to look into this - http://www.bbc.co.uk/news/technology-37198445

**EDIT5**:- Tweet the FTC on twitter @FTC or @TechFTC to make them aware and spur action.

**EDIT6** Looks like it happening - Facebook’s WhatsApp Data Gambit Faces Federal Privacy Complaint http://motherboard.vice.com/read/whatsapp-facebook-privacy-complaint"
Android,Google Now is being left to wither and die as Google Assistant takes the focus,
Android,YouTube no longer lets you tap the seek bar to skip,
Android,Google says it fixed a lot of the security holes the CIA exploited,
Android,Chrome 60 does away with vibrating ads; includes new search widget and payment app integration,
Android,Samsung breakthrough almost doubles lithium battery capacity,
Android,Snapchat Employees Abused Data Access to Spy on Users,
Android,OnePlus is crushing Apple’s iPhone dream in India,
Android,"If you have a Google Keep note called shopping list and you use the voice command ""Add Paper Towels to my shopping list"", Google now will add it, handsfree.",
Android,WhatsApp will progressively kill features until users agree to the new privacy policy,
Android,[Android 5.1 Feature Spotlight] Android Now Recognizes Wi-Fi Connections With No Internet Access And Won't Connect To Them,
Android,"Goodbye, Motorola. Iconic brand to be phased out",
Android,Android's first public beta was released 10 years ago today. Here's the announcement video,
Android,Apple A13 77% faster single-core compared to Qualcomm Snapdragon 855 in Geekbench 5,
Android,"Samsung Galaxy Note 7 goes official with USB Type-C, iris scanner, water-resistant body and more",
Android,"It's still difficult to just buy a Google Pixel today, and that's insane",
Android,"Instagram launches selfie filters, copying the last big Snapchat feature",
Android,Today's CPU vulnerability: what you need to know,
Android,Tasker - Google is taking away SMS/MMS and call functionality from it,
Android,Google Assistant vs Siri!,
Android,Around 2 years ago reddit sync was pulled from Google Play and subsequently reinstated by the support team. Today I've just received a notification from Google telling me I'm violating the same terms 2 years on and face suspension for the exact same issue...,"Really at a loss with this one...

The support team at Google Play after reviewing my previous case agreed that as I included a disclaimer saying sync was not official it could be reinstated (it was pulled for impersonating an official app):

""*Upon further review of the provided information, we've accepted your appeal and have reinstated your applications. You will need to log back into your Android Developer Console to make the necessary changes and re-publish the application so it is available again on Google Play*.""

Just now I've received another email with the following message:

""*Your title and/or description attempts to impersonate or leverage another popular product without permission. Please remove all such references. Do not use irrelevant, misleading, or excessive keywords in apps descriptions, titles, or metadata*.""

I'm not completely confused. My previous case was hand reviewed, the apps reinstated and I'm now being told I have 7 days to change what they said was previously fine or be removed.

I've emailed Google but am yet to get a reply...

Laurence

**edit**: Still no official word back from the Play store but I'm going to jump the gun and just rename to ""Sync for reddit"" and change the art work
"
Android,[MKBHD] Why do people not buy Sony Phones?,
Android,Huawei Surpasses Apple to be the Second Largest Smartphone Brand,
Android,"S21 box packaging leaked, confirms no charger and headphones in the box",
Android,Google Assistant blew my mind today,"Yes, Google knows everything about us, so I probably shouldn't have been so surprised. But yeah, today is my birthday. I said ""Ok Google, good morning,"" to get the daily briefing. In the middle of it, Google was all like ""It's your birthday today. Happy birthday."" Now, up until this point, everything is cool, nothing special at all. But then it starts SINGING. Like literally singing happy birthday to me. I started just dying laughing. Seriously, I'm expecting to get those embarrassing birthday songs sun to me all day today, but Google got a head start on all of it.

Bravo Google. Bravo.

Edit: Holy shit, this got upvoted to the top of the /r/android subreddit. How's that for a birthday surprise."
Android,My app stolen by reverse engineering tools and re_published on google play,"i found my app on Google Play published on two accounts (Nero apps and Rajo Man) the guy decompiled my apk with reverse engineering tools he changed the unit ads so he can get money from it, i report him many time without  getting response from google :(

https://play.google.com/store/apps/details?id=com.neroapps.superhearing
https://play.google.com/store/apps/details?id=com.hearing.superear

https://play.google.com/store/apps/details?id=com.ukapp.hearingsuper"
Android,"Recalled Samsung Note 7 phone explodes in little 6 year old boy’s hands, burns him",
Android,Big-screen phones are becoming a problem and foldable displays aren’t the solution,
Android,"Full Google Pixel 4a Specifications: 6GB RAM with 128GB, $349 USD. Snapdragon 730G. 5.81"" Punch-hole FHD+ HDR 19.5:9 OLED Display, AOD & Now Playing. 3140mAH Battery.",
Android,Google's Translate app is incredible.,
Android,OnePlus is paying for Robert Downey Jr. ads instead of waterproof certification,
Android,"Snapchat has a huge problem with Android, and it's causing investors to worry",
Android,Razr is back,
Android,I hate Google Photos! <happy rant inside>,"I have been an android user for 5-6 years now.. and take lots of photos with my phone. With google photos auto backup, it's almost like take it and forget it.. since you know it will be backed up when it connects to wifi.
  
My daughter was born in December 2015.. and since then, I have taken lots of photos and videos of her around the house with my phone.. first time she crawled, sat upright, etc etc. Google Photos sometimes made a collage of photos or animations.. but what it did today was unfathomable.

Fuck you Google Photos.

You made a grown ass man cry like a baby by automatically making a video titled ""They grow up so fast"".. which has about 45 clips of videos with my daughter in it.. aged around 4-5 months to 22 months (current).

I have watched that 3 minute long video 3 times so far.. first time while I cried like a baby.. next two times with my jaw dropped due to the technology that made this possible.

I know Google Photos is not an ""Android"" topic.. but when it's the same company who makes both, you know you'll be in good hands.

I <3 you Android.

Sincerely,

Your forever customer.
"
Android,"Just turning your phone on qualifies as searching it, court rules: Location data requires a warrant since 2018; lock screen may now, too.",
Android,Official: The Google Assistant is coming to more Android phones,
Android,The galaxy S7 is still receiving security updates after 3.5 years. Samsung promisses 3 years.,
Android,You are looking at it wrong,
Android,"This day in 2013: ""Nexus 5 appears in Google Play store for $349""",
Android,How Killing the 3mm Needlessly Complicates Smartphone Audio,
Android,Google jumps into gaming with Google Stadia streaming service,
Android,MAGA-branded ‘Freedom Phone’ Is a Major Security Hazard,
Android,Googler seemingly confirms that Android Q will have system-wide Dark Mode,
Android,Finally got my Pixel 2 XL today! Only it was missing one thing...,https://imgur.com/a/dpQeb
